{
  "contract_version": 1,
  "suite": "player_machine",
  "case_id": "torrent_boot_to_ready",
  "now_ms": 1739923200000,
  "steps": [
    {
      "t_ms": 0,
      "event": {
        "type": "OPEN_TORRENT",
        "engine": "exo"
      },
      "expect": {
        "phase": "booting_torrent",
        "intent": "play",
        "engine": "exo"
      }
    },
    {
      "t_ms": 1200,
      "event": {
        "type": "TORRENT_STREAM_RESOLVED"
      },
      "expect": {
        "phase": "loading_media",
        "intent": "play",
        "engine": "exo"
      }
    },
    {
      "t_ms": 1450,
      "event": {
        "type": "NATIVE_READY"
      },
      "expect": {
        "phase": "ready",
        "intent": "play",
        "engine": "exo"
      }
    }
  ]
}
